{
  "$schema": "../../.modcreator/schema/tree.json",
  "kind": "tree",
  "id": "sky_willow",
  "name": "Sky Willow",
  "creativeTab": "natural_blocks",
  "tree": {
    "logSide": "art/sky_willow_log.png",
    "logEnd": "art/sky_willow_log_top.png",
    "planks": "art/sky_willow_planks.png",
    "leaves": "art/sky_willow_leaves.png",
    "sapling": "art/sky_willow_sapling.png",
    "shape": "custom",
    "custom": {
      "layers": [
        [".........", ".........", ".........", ".........", "....L....", ".........", ".........", ".........", "........."],
        [".........", ".........", ".........", ".........", "....L....", ".........", ".........", ".........", "........."],
        [".........", "...#.#...", ".........", ".#.....#.", "....L....", ".#.....#.", ".........", "...#.#...", "........."],
        [".........", "...#.#...", ".........", ".#.....#.", "....L....", ".#.....#.", ".........", "...#.#...", "........."],
        [".........", "...#.#...", "..#...#..", ".#.....#.", "....L....", ".#.....#.", "..#...#..", "...#.#...", "........."],
        [".........", "...###...", "..##Z##..", ".###Z###.", ".#XXLXX#.", ".###Z###.", "..##Z##..", "...###...", "........."],
        [".........", "...###...", "..#####..", ".#######.", ".###L###.", ".#######.", "..#####..", "...###...", "........."],
        [".........", ".........", "...###...", "..#####..", "..#####..", "..#####..", "...###...", ".........", "........."],
        [".........", ".........", ".........", "....#....", "...###...", "....#....", ".........", ".........", "........."]
      ],
      "randomRotation": true
    },
    "saplingChance": 0.05
  },
  "shapes": {
    "stairs": true,
    "slab": true
  }
}
